<?xml version="1.0" encoding="UTF-8" standalone="yes"?>
<flowers xmlns="http://www.epam.com/greenhouse"
	xmlns:xsi="http://www.w3.org/2001/XMLSchema-instance"
	xsi:noNamespaceSchemaLocation="flowers.xsd">
	<cutFlower id="f1000">
		<name>Hybrid Tea Rose</name>
		<price>5.50</price>
		<flowerType>SINGLE</flowerType>
	</cutFlower>

	<cutFlower id="f1001">
		<name>Climbing Rose</name>
		<price>4.85</price>
		<flowerType>BUSH</flowerType>
	</cutFlower>

	<pottedFlower id="f1002">
		<name>Floribunda</name>
		<price>11.65</price>
		<bloomAble>0</bloomAble>
	</pottedFlower>

	<pottedFlower id="f1003">
		<name>Grandiflora</name>
		<price>16.00</price>
		<bloomAble>1</bloomAble>
	</pottedFlower>
</flowers>